leelaz_opencl_tuning
0;XgemmBatched;256;100;256;16; -DKWG=32 -DKWI=8 -DMDIMA=16 -DMDIMC=8 -DMWG=64 -DNDIMB=16 -DNDIMC=8 -DNWG=64 -DSA=0 -DSB=1 -DSTRM=0 -DSTRN=1 -DVWM=4 -DVWN=4;OpenCL: NVIDIA Corporation Tesla K80 @ 823MHz
