leelaz_opencl_tuning
0;XgemmBatched;128;25;128;16; -DKWG=32 -DKWI=8 -DMDIMA=8 -DMDIMC=8 -DMWG=32 -DNDIMB=16 -DNDIMC=16 -DNWG=32 -DSA=1 -DSB=1 -DSTRM=0 -DSTRN=1 -DVWM=4 -DVWN=2;OpenCL: NVIDIA Corporation Tesla K80 @ 823MHz
0;XgemmBatched;160;25;160;16; -DKWG=32 -DKWI=8 -DMDIMA=8 -DMDIMC=8 -DMWG=32 -DNDIMB=8 -DNDIMC=8 -DNWG=32 -DSA=1 -DSB=0 -DSTRM=0 -DSTRN=1 -DVWM=4 -DVWN=4;OpenCL: NVIDIA Corporation Tesla K80 @ 823MHz
